{
  "schemaVersion": 1,
  "trackAssetId": "circuit-150",
  "circuitKey": 150,
  "circuitName": "Losail",
  "geometryStatus": "available",
  "rendering": {
    "stroke": "singleColor",
    "showsCornerNumbers": true,
    "showsSegmentColors": false
  },
  "source": {
    "provider": "MultiViewer via OpenF1 circuit_info_url",
    "url": "https://api.multiviewer.app/api/v1/circuits/150/2026",
    "sourceYear": 2023,
    "note": "Normalized for Apex; verify redistribution terms before release."
  },
  "rotationDegrees": 61,
  "viewBox": {
    "minX": -4471,
    "minY": -4614,
    "width": 12518,
    "height": 14666
  },
  "pathPoints": [
    {
      "x": 0.2732065825211695,
      "y": 0.24117005318423565
    },
    {
      "x": 0.2689726793417479,
      "y": 0.24771580526387563
    },
    {
      "x": 0.2646588911966768,
      "y": 0.25432974226101185
    },
    {
      "x": 0.25866751877296695,
      "y": 0.2636710759579981
    },
    {
      "x": 0.2569100495286787,
      "y": 0.26633028774035183
    },
    {
      "x": 0.24996005751717526,
      "y": 0.2771035047047593
    },
    {
      "x": 0.2419715609522288,
      "y": 0.28937678985408427
    },
    {
      "x": 0.23757788784150824,
      "y": 0.2961952816037093
    },
    {
      "x": 0.2290301965170155,
      "y": 0.30935497068048545
    },
    {
      "x": 0.22495606326889278,
      "y": 0.31555979817264423
    },
    {
      "x": 0.2181658411886883,
      "y": 0.32612846038456295
    },
    {
      "x": 0.2117750439367311,
      "y": 0.33601527342151916
    },
    {
      "x": 0.20849976034510306,
      "y": 0.3409927723987454
    },
    {
      "x": 0.2043457421313309,
      "y": 0.34747033956088913
    },
    {
      "x": 0.19739575011982746,
      "y": 0.3582435565252966
    },
    {
      "x": 0.19268253714650901,
      "y": 0.3654711577798991
    },
    {
      "x": 0.18836874900143794,
      "y": 0.37215327969453155
    },
    {
      "x": 0.18173829685253234,
      "y": 0.3824492022364653
    },
    {
      "x": 0.17838312829525482,
      "y": 0.38763125596618025
    },
    {
      "x": 0.17406934015018374,
      "y": 0.3942451929633165
    },
    {
      "x": 0.1652819939287426,
      "y": 0.40740488204009273
    },
    {
      "x": 0.16136763061191883,
      "y": 0.4133369698622665
    },
    {
      "x": 0.15689407253554882,
      "y": 0.4199509068594027
    },
    {
      "x": 0.15050327528359161,
      "y": 0.4295649802263739
    },
    {
      "x": 0.14610960217287106,
      "y": 0.4362471021410064
    },
    {
      "x": 0.14011822974916122,
      "y": 0.4452475112505114
    },
    {
      "x": 0.13612398146668797,
      "y": 0.4511795990726851
    },
    {
      "x": 0.12813548490174148,
      "y": 0.4632483294695213
    },
    {
      "x": 0.12310273206582521,
      "y": 0.47074867039410884
    },
    {
      "x": 0.11455504074133248,
      "y": 0.48363561980090003
    },
    {
      "x": 0.11303722639399265,
      "y": 0.4859539069957725
    },
    {
      "x": 0.10185333120306758,
      "y": 0.50272739669985
    },
    {
      "x": 0.09194759546253395,
      "y": 0.5176598936315288
    },
    {
      "x": 0.08779357724876179,
      "y": 0.5238647211236874
    },
    {
      "x": 0.081642434893753,
      "y": 0.5330696849856812
    },
    {
      "x": 0.07269531874101294,
      "y": 0.5465021137324424
    },
    {
      "x": 0.06542578686691165,
      "y": 0.5574798854493386
    },
    {
      "x": 0.05408212174468765,
      "y": 0.5737760807309423
    },
    {
      "x": 0.05032752835916281,
      "y": 0.5790945042956498
    },
    {
      "x": 0.04289822655376258,
      "y": 0.589799536342561
    },
    {
      "x": 0.03578846461096022,
      "y": 0.6000954588844948
    },
    {
      "x": 0.0267614634925707,
      "y": 0.6136642574662484
    },
    {
      "x": 0.022527560313149064,
      "y": 0.6207554888858584
    },
    {
      "x": 0.019811471481067263,
      "y": 0.6253238783581072
    },
    {
      "x": 0.01637641795814028,
      "y": 0.6315287058502659
    },
    {
      "x": 0.011183895190925068,
      "y": 0.6410064093822446
    },
    {
      "x": 0.007828726633647547,
      "y": 0.6475521614618847
    },
    {
      "x": 0.005751717526761463,
      "y": 0.6520523660166371
    },
    {
      "x": 0.0029557437290301967,
      "y": 0.6594163371062322
    },
    {
      "x": 0.0011183895190925068,
      "y": 0.6660302741033683
    },
    {
      "x": 0.00031953986259785906,
      "y": 0.6710759579980908
    },
    {
      "x": 0,
      "y": 0.6773489704077458
    },
    {
      "x": 0.0004793097938967886,
      "y": 0.6822582844674758
    },
    {
      "x": 0.0011982744847419716,
      "y": 0.6860766398472657
    },
    {
      "x": 0.002716088832081802,
      "y": 0.6909859539069958
    },
    {
      "x": 0.004233903179421633,
      "y": 0.6941906450293195
    },
    {
      "x": 0.005671832561111999,
      "y": 0.6963725623891995
    },
    {
      "x": 0.007908611599297012,
      "y": 0.6994408836765308
    },
    {
      "x": 0.01070458539702828,
      "y": 0.702509204963862
    },
    {
      "x": 0.013260904297811151,
      "y": 0.7048956770762307
    },
    {
      "x": 0.016855727752037065,
      "y": 0.7078958134460658
    },
    {
      "x": 0.019491931618469405,
      "y": 0.7096686213009682
    },
    {
      "x": 0.023725834797891036,
      "y": 0.7121232783308332
    },
    {
      "x": 0.027081003355168557,
      "y": 0.7136915314332469
    },
    {
      "x": 0.03099536667199233,
      "y": 0.7152597845356607
    },
    {
      "x": 0.037625818820897904,
      "y": 0.7171007773080594
    },
    {
      "x": 0.043217766416360444,
      "y": 0.7179871812355108
    },
    {
      "x": 0.05272407732864675,
      "y": 0.7182599209054957
    },
    {
      "x": 0.05631890078287266,
      "y": 0.7180553661530069
    },
    {
      "x": 0.06310912286307717,
      "y": 0.7170325923905632
    },
    {
      "x": 0.06766256590509666,
      "y": 0.7159416337106232
    },
    {
      "x": 0.0732545135005592,
      "y": 0.7141688258557207
    },
    {
      "x": 0.08012462054641316,
      "y": 0.7114414291558707
    },
    {
      "x": 0.08619587793577249,
      "y": 0.7086458475385244
    },
    {
      "x": 0.09226713532513181,
      "y": 0.705509341333697
    },
    {
      "x": 0.09785908292059435,
      "y": 0.7024410200463658
    },
    {
      "x": 0.10169356127176865,
      "y": 0.700327287603982
    },
    {
      "x": 0.1068061990733344,
      "y": 0.6973953361516433
    },
    {
      "x": 0.11375619108483784,
      "y": 0.6934406109368607
    },
    {
      "x": 0.11775043936731107,
      "y": 0.6911905086594845
    },
    {
      "x": 0.12342227192842307,
      "y": 0.6879858175371608
    },
    {
      "x": 0.13181019332161686,
      "y": 0.6832810582299196
    },
    {
      "x": 0.13660329126058476,
      "y": 0.6805536615300696
    },
    {
      "x": 0.14323374340949033,
      "y": 0.6769398609027683
    },
    {
      "x": 0.14994408052404537,
      "y": 0.6731896904404746
    },
    {
      "x": 0.15505671832561113,
      "y": 0.6703941088231283
    },
    {
      "x": 0.15785269212334238,
      "y": 0.6688258557207146
    },
    {
      "x": 0.16448314427224797,
      "y": 0.6651438701759171
    },
    {
      "x": 0.17103371145550408,
      "y": 0.6616664393836084
    },
    {
      "x": 0.17462853490973,
      "y": 0.6597572616937134
    },
    {
      "x": 0.17814347339830644,
      "y": 0.6579844538388109
    },
    {
      "x": 0.18677104968844863,
      "y": 0.6540297286240284
    },
    {
      "x": 0.19220322735261225,
      "y": 0.6520523660166371
    },
    {
      "x": 0.19555839590988977,
      "y": 0.6510977771716896
    },
    {
      "x": 0.20051126378015657,
      "y": 0.6500068184917496
    },
    {
      "x": 0.20706183096341269,
      "y": 0.6493249693167872
    },
    {
      "x": 0.21377216807796773,
      "y": 0.6494613391517796
    },
    {
      "x": 0.22104169995206902,
      "y": 0.6505522978317196
    },
    {
      "x": 0.2271928423070778,
      "y": 0.6522569207691259
    },
    {
      "x": 0.2308675507269532,
      "y": 0.6536888040365472
    },
    {
      "x": 0.23621984342546734,
      "y": 0.6563480158189009
    },
    {
      "x": 0.2390158172231986,
      "y": 0.6580526387563072
    },
    {
      "x": 0.24269052564307397,
      "y": 0.6606436656211646
    },
    {
      "x": 0.24700431378814508,
      "y": 0.6643938360834584
    },
    {
      "x": 0.2514778718645151,
      "y": 0.6695758898131733
    },
    {
      "x": 0.25427384566224637,
      "y": 0.6739397245329333
    },
    {
      "x": 0.2565905096660808,
      "y": 0.679053593345152
    },
    {
      "x": 0.258507748841668,
      "y": 0.6857357152597845
    },
    {
      "x": 0.2591468285668637,
      "y": 0.689963180144552
    },
    {
      "x": 0.25954625339511106,
      "y": 0.6947361243692896
    },
    {
      "x": 0.2596261383607605,
      "y": 0.6978044456566208
    },
    {
      "x": 0.25954625339511106,
      "y": 0.7113732442383744
    },
    {
      "x": 0.2593864834638121,
      "y": 0.7165552979680895
    },
    {
      "x": 0.2593065984981626,
      "y": 0.7198963589254057
    },
    {
      "x": 0.2591468285668637,
      "y": 0.7265784808400382
    },
    {
      "x": 0.25898705863556476,
      "y": 0.7316241647347607
    },
    {
      "x": 0.2587474037386164,
      "y": 0.7389199509068594
    },
    {
      "x": 0.2583479789103691,
      "y": 0.7507159416337106
    },
    {
      "x": 0.25818820897907013,
      "y": 0.7567162143733807
    },
    {
      "x": 0.25802843904777123,
      "y": 0.7644211100504569
    },
    {
      "x": 0.25802843904777123,
      "y": 0.7700804582026456
    },
    {
      "x": 0.2584278638760185,
      "y": 0.7809900450020455
    },
    {
      "x": 0.2594663684294616,
      "y": 0.787944906586663
    },
    {
      "x": 0.26058475794855407,
      "y": 0.793126960316378
    },
    {
      "x": 0.26242211215849176,
      "y": 0.7989226783035592
    },